titulo|fecha|enlace|contenido
Puno consume peces que tienen metales pesados producto de la minería ilegal|2024/08/31|https://diariosinfronteras.com.pe/2024/08/31/puno-consume-peces-que-tienen-metales-pesados-producto-de-la-mineria-ilegal/|Minería ilegal y otras acciones atacan la vida en el lago. La minería ilegal e informal no solo tiene un impacto nocivo en el medio ambiente, sino también en la población que consume peces que absorben los metales pesados, así lo advirtió Bratzo Klauer, coordinador del proyecto Living Lakes. Precisó que existe la necesidad imperiosa de reforzar el cuidado del lago Titicaca, especialmente de los peces que habitan en este lugar. Cuestionó la sobrepesca que hay en Puno, incluso en épocas de veda. Klauer mencionó que la contaminación causada por la población y la minería ilegal es un gran problema. “Los peces, en general tienen la facilidad de absorber los metales pesados (…) y al final las personas los consumimos”, lamentó y agregó que también ha perjudicado el ingreso de otras especies como el pejerrey y la trucha, que son más grandes que los nativos. Seguidamente, refirió que las actividades productivas o pesca indiscriminada deben realizarse de forma responsable, ya que se pone en riesgo la biomasa de peces nativos. Asimismo, pidió que los turistas no hagan sus recorridos fluviales por las zonas donde se reproducen los peces, ya que se atenta contra su población. Es preciso mencionar que, a pesar de tener las facultades correspondientes, la Dirección Regional de la Producción de Puno (Direpro) no impulsa ninguna acción concreta para controlar y fiscalizar la sobrepesca, el transporte y comercialización de las especies acuáticas en peligro de desaparecer como el ispi, carachi y otros peces.
Puno: Conductor en aparente estado de ebriedad ocasionó choque |2024/08/31|https://diariosinfronteras.com.pe/2024/08/31/puno-conductor-en-aparente-estado-de-ebriedad-ocasiono-choque/|Un accidente de tránsito ocurrió la madrugada de hoy en la avenida El Ejército con el jirón Belizario Suárez en la ciudad de Puno, donde una camioneta con placa de rodaje A5I-890 chocó por alcance con la parte posterior de otra camioneta de matrícula VDH-933. La colisión provocó daños materiales en ambos vehículos. Según testigos, el conductor del vehículo que chocó por atrás habría estado ebrio. Los vecinos denunciaron que solo personal de serenazgo llegó al lugar y por horas esperaron a la policía que no llegaba a la escena.
Puneño en México pide justicia por masacre|2024/08/31|https://diariosinfronteras.com.pe/2024/08/31/puneno-en-mexico-pide-justicia-por-masacre/|Durante encuentro continental de medios alternativos. Durante el Primer Encuentro Continental de Comunicadores Independientes, “Informar es Liberar”, que se desarrolla en México con más de 300 periodistas y youtubers, el dirigente y exrepresentante de los trabajadores cachorreros de las minas La Rinconada y Cerro Lunar de Oro, Juvenal Sandro Gil Hallasi, expuso ante el presidente de ese país, Andrés Manuel López Obrador, el régimen dictatorial que vive el Perú. EXPONE A BOLUARTE «Vengo desde la región Puno, región con una cantidad abismal de asesinados por el régimen dictatorial de Dina Ercilia Boluarte Zegarra. Son más de 80 asesinados que hasta hoy no encuentran justicia en el pueblo peruano», dijo en representación del canal alternativo Sallqa TV, que significa ‘El Salvaje’. HACE PEDIDO A MÉXICO En ese marco, hizo una petición al presidente de ese país, para que a través de su Ministerio de Cultura realicen un encuentro latinoamericano de pueblos originarios, al señalar que la vida de estos pareciera no valer nada. «Quechuas, aimaras y uros, entre varones y mujeres, incluso niños, han sido victimados bajo el régimen dictatorial de Dina Boluarte, y hasta el día de hoy no encuentran justicia», agregó. Dijo, además, que en eventos como ese es donde realmente se respira la verdadera democracia, la libertad de expresión y opinión. LO RESPALDAN «Esto es importante y fundamental para cada pueblo. Yo quisiera que se pueda realizar un encuentro latinoamericano de pueblos originarios», finalizó Gil Hallasi, llevándose los aplausos de los asistentes.
Puno: Casi 20 mil maestros participan en proceso de Nombramiento Docente 2024|2024/08/31|https://diariosinfronteras.com.pe/2024/08/31/puno-casi-20-mil-maestros-participan-en-proceso-de-nombramiento-docente-2024/|Minedu establece cronograma hasta diciembre. Mañana domingo 1 de septiembre continuará el segundo día de la Prueba Nacional para el proceso de Nombramiento Docente 2024. A través de este concurso, los postulantes intentarán ingresar a la Carrera Pública Magisterial (CPM) y así tener una mejora en su remuneración mensual. De acuerdo con el Ministerio de Educación (Minedu), un total de 250 mil 542 profesores rendirán la evaluación. En Puno son un total de 19 mil 363 maestros. Ayer viernes fue la primera fecha del examen, donde participaron 3832 docentes en las seis instituciones habilitadas en Puno y 5975 maestros en los nueve locales de Juliaca. LOCALES EN PUNO Mañana, en Puno rendirán esta prueba 3858 profesores en los siguientes locales: Gran Unidad Escolar San Carlos, Glorioso San Carlos, María Auxiliadora, Comercial 45, I.E. Parroquial La Inmaculada y el Instituto de Educación Superior Tecnológica José Antonio Encinas. LOCALES EN JULIACA Mientras que, en Juliaca rendirán el examen 5698 maestros en los siguientes locales: I.E.S. Gran Unidad José Antonio Encinas, colegio Politécnico Los Andes, I.E.S. Gran Unidad Escolar Las Mercedes, UNAJ, I.E.S. San Martín, I.E.S. Pedro Vilcapaza, I.E.S. Horacio Zeballos Gámez, I.E.S. Simón Bolívar y en la Escuela de Educación Superior Pedagógica. El titular de la Dirección Regional de Educación (DRE) de Puno, Edson De Amat, informó que ayer no se registró ningún contratiempo. Un equipo de cuatro personas integran el Comité de Vigilancia y verifican todo el proceso. CRONOGRAMA La publicación de resultados preliminares será el 11 de septiembre. Presentación de reclamos, del 12 al 16 de septiembre. Resolución de reclamos, del 12 al 18 de septiembre. Publicación de resultados finales, el 20 de septiembre. Luego viene la etapa descentralizada, donde deberán registrar su trayectoria profesional y requisitos del 24 de septiembre al 21 de noviembre. Documentos que acrediten los requisitos, del 11 de octubre al 26 de noviembre. Instrumentos de evaluación, del 11 de octubre al 26 de noviembre. El registro de resultados será el 29 de noviembre. La publicación preliminar del 2 al 10 de diciembre. Resolución de reclamos, del 3 al 16 de diciembre. Y la publicación de resultados finales será el 19 de diciembre de 2024.
Puno: Gobierno que ejecute al hospital Manuel Núñez Butrón elegirá terreno|2024/08/30|https://diariosinfronteras.com.pe/2024/08/30/puno-gobierno-que-ejecute-al-hospital-manuel-nunez-butron-elegira-terreno/|Reunión se realizó ayer de forma privada. El gobierno que gane la licitación para la construcción del nuevo hospital regional Manuel Núñez Butrón de Puno elegirá el terreno donde se edificará la nueva infraestructura hospitalaria. Ello se conocerá recién a fin de año. Así adelantó el congresista puneño Carlos Zeballos, tras la reunión que se tuvo en la víspera junto a representantes del Programa Nacional de Inversiones en Salud (Pronis), quienes llegaron a Puno para reevaluar los dos terrenos que se tienen para este hospital: el de Jayllihuaya y de la avenida El Sol. «Se ha generado un enfrentamiento social en el tema técnico, porque no se decide dónde se va a construir el nuevo hospital y como su modalidad será de gobierno a gobierno se ha acordado que el que gane la licitación, tenga la decisión final», dijo. FIRMA DE CONVENIO Añadió que la firma de convenio está prevista para el mes de noviembre de este año, tras ello, entre diciembre y enero, se realizará un nuevo estudio de suelos, de riesgos, entre otros aspectos. Precisó que esta modalidad de ejecución garantiza la culminación de la obra, además de su correcta ejecución. Adelantó que en Jayllihuaya se tendría problemas respecto a la sobreposesión de terrenos, sin embargo, la partida registral ya está saneada; mientras que en la sede actual de la avenida El Sol, existe un tema de delimitación de linderos y hay problemas con el saneamiento. «La próxima reunión será ya para la firma del convenio, con ello este tema ya no será politizado, sino se priorizará la parte técnica», añadió. SALUDAN DECISIÓN Por su parte, el dirigente del centro poblado de Jayllihuaya, Marcelino Mamani, dijo que todo ha quedado en suspenso. Saludó la decisión adoptada y lamentó que el gobernador regional, Richard Hancco, no haya podido sostener su posición, aunque criticó la posición de los representantes de Pronis, que en un momento incluso pretendieron defenderlo. PIDE RECTIFICACIÓN «Se ha llegado a un término medio y tras esta decisión, el gobernador prácticamente ha huido de la reunión, no se quedó hasta el final», acotó. Agregó que remitirá de manera formal al gobernador el informe emitido por la Contraloría que en ninguna página desestima el terreno de Jayllihuaya, a fin de que este se rectifique. Respecto a los memoriales enviados a la presidenta y al Congreso, dijo que aún no tienen respuesta, pero este acercamiento con Pronis ya ha definido prácticamente lo que ocurrirá en adelante. Ahora solo queda esperar la firma de convenio, que probablemente sea con Reino Unido.
Juliaca: Realizan operativo para retirar letreros de negocios|2024/08/30|https://diariosinfronteras.com.pe/2024/08/30/juliaca-realizan-operativo-para-retirar-letreros-de-negocios/|En horas de la madrugada se llevaron los letreros. Aprovechando la oscuridad de la madrugada, trabajadores de la Subgerencia de Gestión Ambiental, en coordinación con la Policía Municipal, Serenazgo y los inspectores de transporte realizaron el operativo de incautación de letreros publicitarios en los jirones Dos de Mayo y Ayacucho con el objetivo de preservar el ornato urbanístico y hacer cumplir las normas municipales vigentes, los establecimientos fueron notificados con anterioridad para que retiren los letreros, lamentablemente hicieron caso omiso a la disposición de las autoridades de la comuna local. El encargado del operativo, abogado Edwin Mamani Flores, dio a conocer algunos detalles de este operativo llevado adelante en estas conocidas calles de la ciudad. “Previo a las intervenciones se realizó la notificación y sensibilización sobre la nueva Ordenanza Municipal N° 001-2024, que regula el ornato de la ciudad y establece parámetros específicos para la colocación de letreros”, señaló el funcionario edil. Agregó que los letreros publicitarios deben estar pegados a la pared y ocupar el 30% de la fachada con un espesor de 5 centímetros, cuyo incumplimiento puede acarrear multas de 1 a 3 Unidades Impositivas Tributarias, según la gravedad de la infracción. En los próximos días realizarán similares operativos en otras calles de la ciudad, donde ya notificaron previamente.
Miniván de Sur Oriente en ruta Puno – Yunguyo|2024/08/30|https://diariosinfronteras.com.pe/2024/08/30/minivan-de-sur-oriente-en-ruta-puno-yunguyo/|Pobladores de Yunguyo fueron atendido en la DRTC. La Dirección Regional de Transportes y Comunicaciones (DRTC) de Puno otorgó la ampliación de la flota vehicular de la Empresa de Transportes Sur Oriente. Con ello se rompió el monopolio, autorizándose cinco unidades vehiculares que cubrirán la ruta Puno – Yunguyo y viceversa. Esto se conoció ayer tras el arribo a la ciudad de Puno, de dirigentes y pobladores de la provincia de Yunguyo, que exigían la referida autorización, para aminorar el costo de los pasajes, ya que denunciaron que la empresa que brinda el servicio de combis en esa ruta suele elevar los costos cuando hay mucha demanda. 5 MINIVANES La resolución que fue notificada ayer al gerente de la Empresa Sur Oriente, Héctor Arpasi, además contempla cinco tarjetas de circulación de los minibuses, que cobrarán S/ 10 el pasaje, en comparación de los S/13 que cobra las combis que prestan ese servicio. El dirigente del Frente Único de Defensa de los Intereses de Yunguyo (FUDIY), José Jordán, agradeció la atención a las demandas del pueblo de Yunguyo, de parte del titular de la DRTC, Beto Portilla, y del director de Circulación, Javier Yapu, pues redundará en el beneficio de los habitantes. Aún se desconoce desde cuándo comenzarán a brindar servicio interprovincial en esa ruta. ¿EMPRESA COIMERA? Jordán denunció que los directivos de la Empresa de combis lo habrían intentado sobornar cuando exigió que reduzcan la tarifa del pasaje. Evitó dar el nombre de quien le hizo semejante propuesta. CONTRA SUNASS Los pobladores luego se fueron a protestar a la oficina de Sunass ante un eventual incremento de las tarifas de agua potable.
Puno: El Mercado Bellavista celebra 53 años con actividades especiales|2024/08/30|https://diariosinfronteras.com.pe/2024/08/30/puno-el-mercado-bellavista-celebra-53-anos-con-actividades-especiales/|Mercado Bellavista. El Mercado Bellavista cumple 53 años, y este sábado se realizarán actividades en vísperas del aniversario. Luego, el domingo, los comerciantes participarán de una misa y del desfile dominical, y finalmente llevarán a cabo una ceremonia central en el centro de abastos. «En los dos años que integramos el consejo directivo, ha existido unión y compañerismo por parte de nuestros asociados. El 5 de septiembre asumirá el cargo la nueva junta directiva, que fue elegida democráticamente», señaló Luz Bravo Quispe, presidenta de la asociación de comerciantes.
Puno: Condenan a 5 años de cárcel a mineros ilegales que contaminan la Cuenca del Ramis|2024/08/30|https://diariosinfronteras.com.pe/2024/08/30/puno-condenan-a-5-anos-de-carcel-a-mineros-ilegales-que-contaminan-la-cuenca-del-ramis/|Mineros ilegales contaminan la Cuenca del Ramis. La Segunda Fiscalía Provincial Especializada en Materia Ambiental, consiguió que se dicte sentencia de 05 años de pena privativa de libertad con carácter de efectiva en contra de René Ochochoque Mamani, como autor del delito de contaminación del medio ambiente agravada por contaminación del rio Ramis producto de actividades de la minería Ilegal. Por su parte el representante del Ministerio Público, dio a conocer que estas actividades ilícitas son de carácter penal, además se sabe que el autor del delito, en su condición de dirigente de la comunidad de Anccoccala, organizó a otros comuneros para realizar actividades relacionadas a la minería ilegal, ocasionando destrucciones de la pradera Alto Andina del rio Ramis. Asimismo, se generó vertimientos de sólidos en suspensión que a su vez ocasionaron gran parte de la contaminación del rio, acciones irregulares que fueron valoradas por el Juzgado Penal Colegiado de San Román, para emitir la pena correspondiente.
Puno: investigan caso del colegio que fue usado para evento social|2024/08/30|https://diariosinfronteras.com.pe/2024/08/30/puno-investigan-caso-del-colegio-que-fue-usado-para-evento-social/|Puno: investigan caso del colegio que fue usado para evento social Carabaya. Las autoridades educativas y municipales han iniciado una investigación exhaustiva para determinar las sanciones por el uso de la Institución Educativa Primaria (IEP) José Carlos Mariátegui para un evento social. En medio de serios cuestionamientos, se ha confirmado una grave infracción a la administración pública en el colegio en mención. Según las investigaciones, el plantel habría sido utilizado como centro de eventos y jaranas, lo que ha generado indignación en la comunidad. Hoy, se constató la presencia de personal y de bebidas alcohólicas, como cerveza, que habrían sido parte de un evento organizado por una persona identificada como Yaria Lizeth. Esta situación agrava aún más la responsabilidad de los involucrados, ya que se utiliza un espacio destinado a la educación para actividades totalmente inapropiadas. Puno: investigan caso del colegio que fue usado para evento social
Puno: Masiva despedida del párroco Edgar Torres en Ananea|2024/08/30|https://diariosinfronteras.com.pe/2024/08/30/puno-masiva-despedida-del-parroco-edgar-torres-en-ananea/|Puno: Masiva despedida del párroco Edgar Torres en Ananea Putina. Cientos de pobladores de Ananea despidieron al párroco Edgar Torres Perdomo en una emotiva ceremonia en el Cementerio Central. La despedida, encabezada por el alcalde Percy Huichi Mamani y autoridades locales, incluyó el nombramiento de Torres como «Hijo Predilecto de Ananea» y el reconocimiento a su familia por su labor social. Edgar Torres, recordado como un líder carismático y defensor de los derechos humanos, falleció trágicamente debido a un derrame cerebral y la falta de atención médica oportuna. La comunidad lo despidió con aplausos y lágrimas, honrando su legado como defensor.
Puno: La institución educativa José Carlos Mariátegui es convertida en una cantina|2024/08/30|https://diariosinfronteras.com.pe/2024/08/30/puno-la-institucion-educativa-jose-carlos-mariategui-es-convertida-en-una-cantina/|Puno La institución educativa José Carlos Mariátegui es convertida en una cantina Carabaya. ¡Escándalo en Macusani! La institución educativa José Carlos Mariátegui, ubicada en la localidad de Tayacucho, a media hora de Macusani, fue el escenario de una jarana que habría sido permitida por las mismas autoridades educativas. Según denuncias recibidas a este medio de comunicación desde tempranas horas de ayer, camiones provistos de estrados ingresaron a la infraestructura educativa, presagiando una opulenta fiesta. Trascendió que el ambiente que es utilizado por niños y niñas de primaria habría sido alquilado, presuntamente por el monto de 5 mil soles para la realización de una fiesta de matrimonio. Para lo cual se habría ingresado grandes cantidades de comida, entre carnes, bocaditos y otros. FIESTA Y ALCOHOL Lo que resulta siendo más grave es que varias aulas de dicha entidad educativa fueron utilizadas como almacén de incontables cajas de cerveza que seguramente serían entregadas como agasajo a los celebrados. Esta adquisición, evidenciaría la ingesta de bebidas alcohólicas dentro de la institución, junto a la presencia de orquestas y demás grupos musicales, por lo que padres de familia temen que la infraestructura de sus hijos sea dañada gravemente. RESPONSABILIDAD El Ministerio de Educación es claro en su normativa: las autoridades educativas deben cumplir con el artículo 133 de la Ley Orgánica de Educación Intercultural (LOEI) y el artículo 330 de su Reglamento General, que califican como falta grave “consumir o promover el consumo de alcohol” y como falta muy grave “comercializar alcohol, tabaco u otras sustancias ilegales dentro de la institución educativa”, apesar de que el día de hoy es feriado por la conmemoración de Santa Rosa de Lima. INTERVE PunoLa institución educativa José Carlos Mariátegui es convertida en una cantina NCIÓN Según los denunciantes, ante la gravedad del hecho, la UGEL Carabaya debe intervenir a través de su órgano de Control Interno y del especialista de personal, quien deberá levantar un acta correspondiente para esclarecer los motivos detrás del uso indebido del recinto escolar y la ingesta de bebidas alcohólicas. SIN RESPUESTA Cabe resaltar que intentamos contactar a la directora de la UGEL, Mariana Liliana Gutiérrez Maita, y al titular de la Dirección Regional de Educación Puno, Edson de Amat Apaza Apaza, pero no obtuvimos respuesta. Sin embargo, el especialista en personal de la UGEL Carabaya, Gualberto Laura Quilla, señaló que este no sería el único caso, ya que varias instituciones habrían solicitado permisos similares para celebrar fiestas patronales, entre otros eventos. Añadió que se encuentran investigando estas denuncias. PunoLa institución educativa José Carlos Mariátegui es convertida en una cantinaPunoLa institución educativa José Carlos Mariátegui es convertida en una cantina
Puno: Encapuchados intentan robar vehículo durante la madrugada|2024/08/30|https://diariosinfronteras.com.pe/2024/08/30/puno-encapuchados-intentan-robar-vehiculo-durante-la-madrugada/|Puno: Encapuchados intentan robar vehículo durante la madrugada San Miguel. Robo frustrado. Dos delincuentes encapuchados intentaron robar una camioneta en una vivienda ubicada en el cruce de los jirones Ubinas y Alpamayo, en el distrito de San Miguel, durante la madrugada de ayer. Sin embargo, su plan fue frustrado gracias a la rápida reacción del agraviado que alertó al Serenazgo. INTENTO DE ROBO Según la denuncia, los hechos ocurrieron aproximadamente a la 1:40 a.m. de la víspera, cuando Juvenal C.O., propietario del vehículo, fue despertado por ruidos extraños provenientes de la cochera. Al bajar a verificar, se encontró con los delincuentes intentando llevarse su camioneta. Ante la sorpresiva presencia del dueño de casa, los malhechores emprendieron la huida, logrando escapar antes de ser capturados. Al lugar llegaron agentes del Serenazgo y de la Policía, quienes realizaron las diligencias correspondientes para dar con el paradero de los delincuentes que querían perpetrar el delito.
Puno: Mujer denunció ultraje al salir de una discoteca de Juliaca|2024/08/30|https://diariosinfronteras.com.pe/2024/08/30/puno-mujer-denuncio-ultraje-al-salir-de-una-discoteca-de-juliaca/|Puno: Mujer denunció ultraje al salir de una discoteca de Juliaca Juliaca. Los efectivos del Área de Investigación Criminal (Areincri) PNP de Juliaca, detuvieron a Jainson Sergio M.S. (24 años), quien es investigado por el presunto delito de violación sexual en agravio de una joven de 22 años. LOS HECHOS Según la denuncia interpuesta por la víctima, identificada con las iniciales K.J.Z., los hechos ocurrieron la noche del miércoles en la ciudad de Juliaca. Supuestamente, ambas personas coincidieron para divertirse en la discoteca “Moda”, donde compartieron algunas bebidas alcohólicas. Asimismo, al finalizar la noche, cuando K.J.Z. se disponía a retirarse del local, Jainson Sergio M.S. la interceptó en el exterior de la discoteca. De manera violenta, la obligó a subir a una moto “torito”, sujetándola fuertemente del cuello para evitar que se resista. De acuerdo a la investigación preliminar, no existiría ningún tipo de relación sentimental o amistad entre la dama y el imputado. EL ATAQUE Una vez a bordo del vehículo, el presunto agresor la llevó hasta su vivienda, ubicada en la urbanización La Capilla. Allí, en una habitación del segundo piso, habría cometido el abuso sexual en contra de la joven, sometiéndola a sus deseos sin su consentimiento. LA DENUNCIA Y DETENCIÓN Tras el traumático suceso, la víctima logró escapar y se dirigió de inmediato a las instalaciones del Depincri PNP, para denunciar los hechos. Es así que los agentes policiales, actuando con celeridad, iniciaron un operativo que culminó con la captura de Jainson Sergio M.S. en su domicilio, antes de que concluya el plazo de flagrancia. Asimismo, el Ministerio Público y la Policía Especializada iniciaron con las investigaciones correspondientes para esclarecer el caso y determinar las responsabilidades penales del detenido.
Campaña de vacunas contra la sarampión en Puno|2024/08/29|https://diariosinfronteras.com.pe/2024/08/29/campana-de-vacunas-contra-la-sarampion-en-puno/|Dudas respecto a convencimiento de la población. La directora ejecutiva de la Dirección de Inmunizaciones del Ministerio de Salud (Minsa), Magdalena Del Rosario Quepuy Izarra, señaló que las campañas de vacunación contra el sarampión están fallando en su componente comunicacional y de socialización. Según dijo, esta deficiencia está afectando la cobertura y efectividad de la inmunización precisando que las direcciones regionales de Salud de los gobiernos regionales también son responsables de ejecutar estas campañas de comunicación y sensibilización, siguiendo las directrices del Minsa, por ello resaltó la importancia de que las autoridades regionales refuercen sus estrategias comunicacionales para informar a la población sobre la relevancia de las vacunas contra el sarampión y evitar la falsa información que se difunde por las redes sociales. CAMPAÑA Estas precisiones las hizo durante la presentación de la campaña de barrido contra el sarampión que se iniciará este 15 de setiembre y explicó que previo a ello ya se debió fortalecer la etapa comunicativa para llegar a la población con mensajes donde se informen sobre lo beneficioso para la salud de sus hijos que estén protegidos, aunque todavía existen dudas de la efectividad comunicacional de la Diresa. CIFRAS LAPIDARIAS Según informó, son 100 mil niños en la región que no están vacunados contra el sarampión y Puno aparece en los últimos lugares de cobertura a nivel nacional. En esta campaña se vacunará a niños de 1 a 6 años de edad y se tiene como objetivo proteger a 99715 menores en toda la región.
